{
  "artifact_id": "recipe-find-free-time",
  "artifact_kind": "skill_pack",
  "attestation": {
    "algorithm": "ES256",
    "claims_digest": "sha256:daa476f7795424c33d5399e01cef748fb31602e80d5ee80a8c5d560dc1eb0af6",
    "issuer": "linkskills-publisher",
    "key_id": "linkskills-draft-unqualified",
    "signature": "draft-unqualified-no-signature",
    "trust_boundary": "linkskills-release-attestation"
  },
  "bundle_hash": "sha256:daa476f7795424c33d5399e01cef748fb31602e80d5ee80a8c5d560dc1eb0af6",
  "channel": "canary",
  "content_digest": "sha256:daa476f7795424c33d5399e01cef748fb31602e80d5ee80a8c5d560dc1eb0af6",
  "eligibility_ref": "opaque:eligibility:recipe-find-free-time-ineligible",
  "execution_profiles": [
    "gws-consumer"
  ],
  "inventory_digest": "sha256:bf7fdc190b56bb789bf61edd0253b134965b66ec7d82deacdcb2902a02236e65",
  "lifecycle_state": "eval_pending",
  "lineage": {
    "kind": "vendor",
    "relationship": "preserved_vendor_bytes",
    "upstream_release_id": null
  },
  "manifest": {
    "entry_hashes": [
      {
        "path": "SKILL.md",
        "sha256": "daa476f7795424c33d5399e01cef748fb31602e80d5ee80a8c5d560dc1eb0af6",
        "size": 958
      }
    ],
    "file_count": 1,
    "total_bytes": 958
  },
  "notes": "Approved source candidate for internal canary use; stable qualification, consumer activation, tool authority, and live publication are not claimed.",
  "provenance": {
    "licence": "Apache-2.0",
    "publisher": "Google Workspace CLI",
    "repository": "https://github.com/googleworkspace/cli",
    "retrieved_at": "2026-08-24T00:00:00Z",
    "source_commit": "a3768d0e82ad83cca2da97724e46bea4ff0e6dbd",
    "source_path": "skills/recipe-find-free-time/SKILL.md",
    "source_ref": "main@a3768d0e82ad83cca2da97724e46bea4ff0e6dbd",
    "trust_boundary": "linkskills-release-provenance"
  },
  "published_at": "2026-08-24T00:00:00Z",
  "publisher": "LiNKskills",
  "release_id": "recipe-find-free-time@0.22.5",
  "release_kind": "vendor",
  "resource_descriptors": [
    "opaque:resource:recipe-find-free-time-skill-md"
  ],
  "retrieved_at": "2026-08-24T00:00:00Z",
  "schema_version": "0.1",
  "source_commit": "a3768d0e82ad83cca2da97724e46bea4ff0e6dbd",
  "source_path": "skills/recipe-find-free-time",
  "source_ref": "main@a3768d0e82ad83cca2da97724e46bea4ff0e6dbd",
  "storage_uri": "vendor-skills://google-workspace/recipe-find-free-time/0.22.5",
  "version": "0.22.5"
}
