{
  "artifact_id": "gws-workflow-weekly-digest",
  "artifact_kind": "skill_pack",
  "attestation": {
    "algorithm": "ES256",
    "claims_digest": "sha256:6ece4c91d1810bc42d98a2cb25dc939b136c4bd108a325dfd6b097fc801dc86f",
    "issuer": "linkskills-publisher",
    "key_id": "linkskills-draft-unqualified",
    "signature": "draft-unqualified-no-signature",
    "trust_boundary": "linkskills-release-attestation"
  },
  "bundle_hash": "sha256:6ece4c91d1810bc42d98a2cb25dc939b136c4bd108a325dfd6b097fc801dc86f",
  "channel": "canary",
  "content_digest": "sha256:6ece4c91d1810bc42d98a2cb25dc939b136c4bd108a325dfd6b097fc801dc86f",
  "eligibility_ref": "opaque:eligibility:gws-workflow-weekly-digest-ineligible",
  "execution_profiles": [
    "gws-consumer"
  ],
  "inventory_digest": "sha256:4ff25d663af08ad5899d938d5ad8a4eb024324619a10db50f676f6f8994fc55d",
  "lifecycle_state": "eval_pending",
  "lineage": {
    "kind": "vendor",
    "relationship": "preserved_vendor_bytes",
    "upstream_release_id": null
  },
  "manifest": {
    "entry_hashes": [
      {
        "path": "SKILL.md",
        "sha256": "6ece4c91d1810bc42d98a2cb25dc939b136c4bd108a325dfd6b097fc801dc86f",
        "size": 1132
      }
    ],
    "file_count": 1,
    "total_bytes": 1132
  },
  "notes": "Approved source candidate for internal canary use; stable qualification, consumer activation, tool authority, and live publication are not claimed.",
  "provenance": {
    "licence": "Apache-2.0",
    "publisher": "Google Workspace CLI",
    "repository": "https://github.com/googleworkspace/cli",
    "retrieved_at": "2026-08-24T00:00:00Z",
    "source_commit": "a3768d0e82ad83cca2da97724e46bea4ff0e6dbd",
    "source_path": "skills/gws-workflow-weekly-digest/SKILL.md",
    "source_ref": "main@a3768d0e82ad83cca2da97724e46bea4ff0e6dbd",
    "trust_boundary": "linkskills-release-provenance"
  },
  "published_at": "2026-08-24T00:00:00Z",
  "publisher": "LiNKskills",
  "release_id": "gws-workflow-weekly-digest@0.22.5",
  "release_kind": "vendor",
  "resource_descriptors": [
    "opaque:resource:gws-workflow-weekly-digest-skill-md"
  ],
  "retrieved_at": "2026-08-24T00:00:00Z",
  "schema_version": "0.1",
  "source_commit": "a3768d0e82ad83cca2da97724e46bea4ff0e6dbd",
  "source_path": "skills/gws-workflow-weekly-digest",
  "source_ref": "main@a3768d0e82ad83cca2da97724e46bea4ff0e6dbd",
  "storage_uri": "vendor-skills://google-workspace/gws-workflow-weekly-digest/0.22.5",
  "version": "0.22.5"
}
