{
  "artifact_id": "awesome-neumorphism",
  "artifact_kind": "skill_pack",
  "attestation": {
    "algorithm": "ES256",
    "claims_digest": "sha256:4e0ab718f5ef9fdca65a83ede51cbc0a26e6913a6309c3b61f0db7941f998ac0",
    "issuer": "linkskills-publisher",
    "key_id": "linkskills-draft-intake",
    "signature": "draft-pending-evaluation-no-signature",
    "trust_boundary": "linkskills-release-attestation"
  },
  "bundle_hash": "sha256:24f6fe034baed8043d4762decfa044780932f4189103a46a84bb5f1c149e88a5",
  "channel": "development",
  "content_digest": "sha256:4e0ab718f5ef9fdca65a83ede51cbc0a26e6913a6309c3b61f0db7941f998ac0",
  "eligibility_ref": "opaque:eligibility:awesome-neumorphism-ineligible",
  "execution_profiles": [
    "cursor-macos",
    "codex-macos"
  ],
  "inventory_digest": "sha256:24f6fe034baed8043d4762decfa044780932f4189103a46a84bb5f1c149e88a5",
  "lifecycle_state": "unqualified",
  "lineage": {
    "kind": "vendor",
    "relationship": "preserved_vendor_bytes",
    "upstream_release_id": null
  },
  "manifest": {
    "entry_hashes": [
      {
        "path": "DESIGN.md",
        "sha256": "173b515779ea215fe6b27eb19e742003ceabda29caae91ae94accb76dba58665",
        "size": 1620
      },
      {
        "path": "SKILL.md",
        "sha256": "febede46065b3ff832f37dc73ee424276825ae83fa228e7cab9ce60e724433b5",
        "size": 3794
      }
    ],
    "file_count": 2,
    "total_bytes": 5414
  },
  "notes": "Preserved vendor/adapted-source bytes; not qualified or consumer-activated.",
  "provenance": {
    "licence": "MIT",
    "publisher": "Bergside",
    "repository": "https://github.com/bergside/awesome-design-skills",
    "retrieved_at": "2026-08-31T08:00:00Z",
    "source_commit": "f631a09b4fcc0166f2e2c1a8c81906ef680c57e8",
    "source_path": "skills/neumorphism/SKILL.md",
    "source_ref": "main@f631a09b4fcc0166f2e2c1a8c81906ef680c57e8",
    "trust_boundary": "linkskills-release-provenance"
  },
  "published_at": "2026-08-31T08:00:00Z",
  "publisher": "Bergside",
  "release_id": "awesome-neumorphism@1.0.0",
  "release_kind": "vendor",
  "resource_descriptors": [
    "opaque:resource:awesome-neumorphism-skill-md"
  ],
  "retrieved_at": "2026-08-31T08:00:00Z",
  "schema_version": "0.1",
  "source_commit": "f631a09b4fcc0166f2e2c1a8c81906ef680c57e8",
  "source_path": "skills/neumorphism/SKILL.md",
  "source_ref": "main@f631a09b4fcc0166f2e2c1a8c81906ef680c57e8",
  "storage_uri": "vendor-skills://awesome-design/awesome-neumorphism/1.0.0",
  "version": "1.0.0"
}
