{
  "artifact_id": "gstack-review",
  "artifact_kind": "skill_pack",
  "attestation": {
    "algorithm": "ES256",
    "claims_digest": "sha256:88f1286fa1def942b2aece7fcdb047ec47aa9a694b2c3cbeb991b0e2fbb78a4b",
    "issuer": "linkskills-publisher",
    "key_id": "linkskills-draft-intake",
    "signature": "draft-pending-evaluation-no-signature",
    "trust_boundary": "linkskills-release-attestation"
  },
  "bundle_hash": "sha256:5e97fac5286488bc433c031eea90ff16cdf2c8d1b11c9517f30f8f05580b7e0d",
  "channel": "development",
  "content_digest": "sha256:88f1286fa1def942b2aece7fcdb047ec47aa9a694b2c3cbeb991b0e2fbb78a4b",
  "eligibility_ref": "opaque:eligibility:gstack-review-ineligible",
  "execution_profiles": [
    "cursor-macos",
    "codex-macos"
  ],
  "inventory_digest": "sha256:5e97fac5286488bc433c031eea90ff16cdf2c8d1b11c9517f30f8f05580b7e0d",
  "lifecycle_state": "unqualified",
  "lineage": {
    "kind": "vendor",
    "relationship": "preserved_vendor_bytes",
    "upstream_release_id": null
  },
  "manifest": {
    "entry_hashes": [
      {
        "path": "SKILL.md",
        "sha256": "371cdd529ddd8c9a9c12616ae2bdb6f5abb3bb4aff62c83044a2e01c714cb9c8",
        "size": 105811
      },
      {
        "path": "SKILL.md.tmpl",
        "sha256": "c803e5d15c02e6f54b7db7c8bb8afba524a410f94614a0e4b7fdb2cbf3257204",
        "size": 14099
      },
      {
        "path": "TODOS-format.md",
        "sha256": "faf7774c45356ee7990cba0289ca71bf77491394608052e4f711f5436046613c",
        "size": 1656
      },
      {
        "path": "checklist.md",
        "sha256": "1fb9c5eafa0db7c95156559deea07c77f388fb47db27aeee8ab3ca1ee1f7ad7c",
        "size": 11562
      },
      {
        "path": "design-checklist.md",
        "sha256": "e6f4ac34f034005c7fc91e4008bb8101a0973a26230b86b50c4f580182e6c8bb",
        "size": 6704
      },
      {
        "path": "greptile-triage.md",
        "sha256": "60fbc224b9b54c0d1fea884d5caf5b1b03957c07fccddb9ba7cedff988920bbd",
        "size": 8271
      },
      {
        "path": "specialists/api-contract.md",
        "sha256": "263d23ac119dd601d315c191dbdbd503d47c00264c9c0ca81959559ca11d4e95",
        "size": 2357
      },
      {
        "path": "specialists/data-migration.md",
        "sha256": "b6fd9eb229002ea598f8fe9ff53b1cd8821e3bd37a7aa7b07b5526556c71ebca",
        "size": 2306
      },
      {
        "path": "specialists/maintainability.md",
        "sha256": "7d945a69e0763fd1be26ffdff65f1088cab555d80630ed4ad44313e5e6623036",
        "size": 2325
      },
      {
        "path": "specialists/performance.md",
        "sha256": "545c294ae53638b4c8524e8cde08246a4ce3b5c287ec7c44e27f5556a3b0e8cc",
        "size": 2618
      },
      {
        "path": "specialists/red-team.md",
        "sha256": "9ea05149f5b13d6a19ecec26285142d09d259cf80a515af828abdd1f43320427",
        "size": 2258
      },
      {
        "path": "specialists/security.md",
        "sha256": "d0dc1cf0f1c7450507cfc663a67624cbcd5d4cfd0258a3bfeb51dba6f09c7df2",
        "size": 3025
      },
      {
        "path": "specialists/testing.md",
        "sha256": "3fd6dc5d802fd112f75934c4c168c3f03e25275b70e1e403eb670cbf7447e4e7",
        "size": 2226
      }
    ],
    "file_count": 13,
    "total_bytes": 165218
  },
  "notes": "Preserved vendor/adapted-source bytes; not qualified or consumer-activated.",
  "provenance": {
    "licence": "MIT",
    "publisher": "LiNKtrend IDE Development",
    "repository": "https://github.com/linktrend/IDE-Development",
    "retrieved_at": "2026-08-31T08:00:00Z",
    "source_commit": "e32b578e2d11dcdf6e24baa8022f577efa26da24",
    "source_path": "core/runtime/skills/gstack/review/SKILL.md",
    "source_ref": "development@e32b578e2d11dcdf6e24baa8022f577efa26da24",
    "trust_boundary": "linkskills-release-provenance"
  },
  "published_at": "2026-08-31T08:00:00Z",
  "publisher": "LiNKtrend IDE Development",
  "release_id": "gstack-review@1.0.0",
  "release_kind": "vendor",
  "resource_descriptors": [
    "opaque:resource:gstack-review-skill-md"
  ],
  "retrieved_at": "2026-08-31T08:00:00Z",
  "schema_version": "0.1",
  "source_commit": "e32b578e2d11dcdf6e24baa8022f577efa26da24",
  "source_path": "core/runtime/skills/gstack/review/SKILL.md",
  "source_ref": "development@e32b578e2d11dcdf6e24baa8022f577efa26da24",
  "storage_uri": "vendor-skills://hybrid-development/gstack-review/1.0.0",
  "version": "1.0.0"
}
