{
  "artifact_id": "awesome-immersive",
  "artifact_kind": "skill_pack",
  "attestation": {
    "algorithm": "ES256",
    "claims_digest": "sha256:0a3b1d261ee19b20b9e88b248be9fbb49acbf50fc1c45906c7e49edb38fa8458",
    "issuer": "linkskills-publisher",
    "key_id": "linkskills-draft-intake",
    "signature": "draft-pending-evaluation-no-signature",
    "trust_boundary": "linkskills-release-attestation"
  },
  "bundle_hash": "sha256:0d59538ff141e341f44f335d5cfa331d79dcd0fbe8cb572d32a4a4307246a15a",
  "channel": "development",
  "content_digest": "sha256:0a3b1d261ee19b20b9e88b248be9fbb49acbf50fc1c45906c7e49edb38fa8458",
  "eligibility_ref": "opaque:eligibility:awesome-immersive-ineligible",
  "execution_profiles": [
    "cursor-macos",
    "codex-macos"
  ],
  "inventory_digest": "sha256:0d59538ff141e341f44f335d5cfa331d79dcd0fbe8cb572d32a4a4307246a15a",
  "lifecycle_state": "unqualified",
  "lineage": {
    "kind": "vendor",
    "relationship": "preserved_vendor_bytes",
    "upstream_release_id": null
  },
  "manifest": {
    "entry_hashes": [
      {
        "path": "DESIGN.md",
        "sha256": "c3dfbefac7436cdc1cd17096155c2033df97c460a9e91f6188904f3aa3b9eae3",
        "size": 1538
      },
      {
        "path": "SKILL.md",
        "sha256": "ac9f23c3b81fe2bea859b94ce99700f538f952a4775a5f5125a4e32f32c42420",
        "size": 4330
      }
    ],
    "file_count": 2,
    "total_bytes": 5868
  },
  "notes": "Preserved vendor/adapted-source bytes; not qualified or consumer-activated.",
  "provenance": {
    "licence": "MIT",
    "publisher": "Bergside",
    "repository": "https://github.com/bergside/awesome-design-skills",
    "retrieved_at": "2026-08-31T08:00:00Z",
    "source_commit": "f631a09b4fcc0166f2e2c1a8c81906ef680c57e8",
    "source_path": "skills/immersive/SKILL.md",
    "source_ref": "main@f631a09b4fcc0166f2e2c1a8c81906ef680c57e8",
    "trust_boundary": "linkskills-release-provenance"
  },
  "published_at": "2026-08-31T08:00:00Z",
  "publisher": "Bergside",
  "release_id": "awesome-immersive@1.0.0",
  "release_kind": "vendor",
  "resource_descriptors": [
    "opaque:resource:awesome-immersive-skill-md"
  ],
  "retrieved_at": "2026-08-31T08:00:00Z",
  "schema_version": "0.1",
  "source_commit": "f631a09b4fcc0166f2e2c1a8c81906ef680c57e8",
  "source_path": "skills/immersive/SKILL.md",
  "source_ref": "main@f631a09b4fcc0166f2e2c1a8c81906ef680c57e8",
  "storage_uri": "vendor-skills://awesome-design/awesome-immersive/1.0.0",
  "version": "1.0.0"
}
