{
  "artifact_id": "company-planning-performance",
  "artifact_kind": "skill_pack",
  "attestation": {
    "algorithm": "ES256",
    "claims_digest": "sha256:814df2cef3055dc83162eb0f27377c27064c5992198f59b853c3906696cac64d",
    "issuer": "linkskills-publisher",
    "key_id": "linkskills-draft-unqualified",
    "signature": "draft-unqualified-no-signature",
    "trust_boundary": "linkskills-release-attestation"
  },
  "bundle_hash": "sha256:814df2cef3055dc83162eb0f27377c27064c5992198f59b853c3906696cac64d",
  "channel": "development",
  "content_digest": "sha256:e617fe4d3bf15e7903c0cf27ffaca9013ff4790a36039dafdce9d69d506ed473",
  "eligibility_ref": "opaque:eligibility:company-planning-performance-1",
  "execution_profiles": [
    "cursor-macos"
  ],
  "inventory_digest": "sha256:e617fe4d3bf15e7903c0cf27ffaca9013ff4790a36039dafdce9d69d506ed473",
  "lifecycle_state": "draft",
  "lineage": {
    "kind": "native",
    "relationship": "none",
    "upstream_release_id": null
  },
  "manifest": {
    "entry_hashes": [
      {
        "path": "SKILL.md",
        "sha256": "0062e0e9d9974e95afc673914bd640bd65318a26311f1334c547300a915046f2",
        "size": 4584
      },
      {
        "path": "advanced/advanced.md",
        "sha256": "f04a1d8087ba1914f20167c9b66122a800df310bb2572ecac1955cbdfb4eb36e",
        "size": 1192
      },
      {
        "path": "examples/error-recovery.md",
        "sha256": "9cc0b89b4d949b29641b49b363befa1e1b1c820eb832caa04d47bf3304c2dc2c",
        "size": 340
      },
      {
        "path": "examples/success-pattern.md",
        "sha256": "228e78aa9381b7a014ed83b87d35a5e3a23406e717ad8aeb71648f1330a6af3a",
        "size": 473
      },
      {
        "path": "references/api-specs.md",
        "sha256": "1a22bd13266ae9dfc7b705ce47a6aec787ebed6a600079d1bc4aebc6f49b11b8",
        "size": 1423
      },
      {
        "path": "references/changelog.md",
        "sha256": "bf373683344c75f7d14b8d55d6ede88b29424b48b9f128958bcaa273bde8f3c9",
        "size": 360
      },
      {
        "path": "references/eval-suite.json",
        "sha256": "081c20e598c6bacedf2fdeb27c1cc14cdade378c0ee7340ce66e65e629d50191",
        "size": 3313
      },
      {
        "path": "references/eval-suite.yaml",
        "sha256": "a7286681c2edabfc1694f481c45a6f157b91b317afbafd15aadc391708f3851c",
        "size": 12403
      },
      {
        "path": "references/old-patterns.md",
        "sha256": "780ed3c42d955349fed5fabc11e9af3289ed125cf83fd22d6b0e1bb027fc8af0",
        "size": 439
      },
      {
        "path": "references/remainder-eval-cases.json",
        "sha256": "d9335a7e283300acb089adb50040f11afdb6ab3b544b49749a63939976bc9953",
        "size": 2986
      },
      {
        "path": "references/schemas.json",
        "sha256": "87c3bef01208c2c731a1aec2842012fab8a576eaaaf0dc4bf40639c42d52b477",
        "size": 7937
      },
      {
        "path": "references/skill-pack.json",
        "sha256": "5638c368351da41c9ecf474d0df3e044713d7a0253647a71fbe8ce9045b1ae17",
        "size": 4003
      },
      {
        "path": "scripts/README.md",
        "sha256": "ad9b2dee2b7644eac09000485dcef12109eeb02a4b45dc082fa1cec535f9c380",
        "size": 500
      },
      {
        "path": "scripts/eval_driver.py",
        "sha256": "5074f3ec735ea52398e32e3fa932c935e85a97517078d524b8dc3980977551f1",
        "size": 8610
      },
      {
        "path": "scripts/helper_tool.py",
        "sha256": "26598d912080c9a584eea46db2ec8a1f8ae1077a01ac444c423a24fba2e4e5b0",
        "size": 13279
      }
    ],
    "file_count": 15,
    "total_bytes": 61842
  },
  "notes": "PKT-22 exact source identity only; draft/unqualified and not selectable.",
  "provenance": {
    "licence": "LiNKtrend internal",
    "publisher": "LiNKskills",
    "repository": "https://github.com/linktrend/LiNKskills",
    "retrieved_at": "2026-08-31T00:00:00Z",
    "source_commit": "2e03130b5d8e801a066da504e6ff444f1ff3d46c",
    "source_path": "skills/company-planning-performance",
    "source_ref": "issue/374-complete-all-remaining-linkskills-catalog-qualif",
    "trust_boundary": "linkskills-release-provenance"
  },
  "published_at": "2026-08-31T00:00:00Z",
  "publisher": "LiNKskills",
  "release_id": "company-planning-performance@1.0.0",
  "release_kind": "native",
  "resource_descriptors": [
    "opaque:resource:company-planning-performance-skill-md"
  ],
  "retrieved_at": "2026-08-31T00:00:00Z",
  "schema_version": "0.1",
  "source_commit": "2e03130b5d8e801a066da504e6ff444f1ff3d46c",
  "source_path": "skills/company-planning-performance",
  "source_ref": "issue/374-complete-all-remaining-linkskills-catalog-qualif",
  "version": "1.0.0"
}
