{
  "artifact_id": "awesome-clean",
  "artifact_kind": "skill_pack",
  "attestation": {
    "algorithm": "ES256",
    "claims_digest": "sha256:f036f8edbfe49a4a2499b79edd72dc8676a641a33842a9f709dc85c645d3d5bf",
    "issuer": "linkskills-publisher",
    "key_id": "linkskills-draft-intake",
    "signature": "draft-pending-evaluation-no-signature",
    "trust_boundary": "linkskills-release-attestation"
  },
  "bundle_hash": "sha256:562b3bfb8a090e9abc0eba805860f7f77672cdfba37972dbafc2d3036c6caacb",
  "channel": "development",
  "content_digest": "sha256:f036f8edbfe49a4a2499b79edd72dc8676a641a33842a9f709dc85c645d3d5bf",
  "eligibility_ref": "opaque:eligibility:awesome-clean-ineligible",
  "execution_profiles": [
    "cursor-macos",
    "codex-macos"
  ],
  "inventory_digest": "sha256:562b3bfb8a090e9abc0eba805860f7f77672cdfba37972dbafc2d3036c6caacb",
  "lifecycle_state": "unqualified",
  "lineage": {
    "kind": "vendor",
    "relationship": "preserved_vendor_bytes",
    "upstream_release_id": null
  },
  "manifest": {
    "entry_hashes": [
      {
        "path": "DESIGN.md",
        "sha256": "602622a6de325629ef9d907357d97b99de9c6b0dcb4dc31b2b415e45170ed3c1",
        "size": 1534
      },
      {
        "path": "SKILL.md",
        "sha256": "2422a64f5037d8e3c16a04f657d295f82f0bbf528648e703ba32148f3f7d9526",
        "size": 3669
      }
    ],
    "file_count": 2,
    "total_bytes": 5203
  },
  "notes": "Preserved vendor/adapted-source bytes; not qualified or consumer-activated.",
  "provenance": {
    "licence": "MIT",
    "publisher": "Bergside",
    "repository": "https://github.com/bergside/awesome-design-skills",
    "retrieved_at": "2026-08-31T08:00:00Z",
    "source_commit": "f631a09b4fcc0166f2e2c1a8c81906ef680c57e8",
    "source_path": "skills/clean/SKILL.md",
    "source_ref": "main@f631a09b4fcc0166f2e2c1a8c81906ef680c57e8",
    "trust_boundary": "linkskills-release-provenance"
  },
  "published_at": "2026-08-31T08:00:00Z",
  "publisher": "Bergside",
  "release_id": "awesome-clean@1.0.0",
  "release_kind": "vendor",
  "resource_descriptors": [
    "opaque:resource:awesome-clean-skill-md"
  ],
  "retrieved_at": "2026-08-31T08:00:00Z",
  "schema_version": "0.1",
  "source_commit": "f631a09b4fcc0166f2e2c1a8c81906ef680c57e8",
  "source_path": "skills/clean/SKILL.md",
  "source_ref": "main@f631a09b4fcc0166f2e2c1a8c81906ef680c57e8",
  "storage_uri": "vendor-skills://awesome-design/awesome-clean/1.0.0",
  "version": "1.0.0"
}
