{
  "artifact_id": "taste-imagegen-frontend-mobile",
  "artifact_kind": "skill_pack",
  "attestation": {
    "algorithm": "ES256",
    "claims_digest": "sha256:04816d59a395bd6d4086b5ce5c1649c1646784c956a0c6ce425a76a8bfe553a6",
    "issuer": "linkskills-publisher",
    "key_id": "linkskills-draft-intake",
    "signature": "draft-pending-evaluation-no-signature",
    "trust_boundary": "linkskills-release-attestation"
  },
  "bundle_hash": "sha256:24d6d8e4601342f235d7b445cf048eae473af305d23481a7d7d12b17b4758161",
  "channel": "development",
  "content_digest": "sha256:04816d59a395bd6d4086b5ce5c1649c1646784c956a0c6ce425a76a8bfe553a6",
  "eligibility_ref": "opaque:eligibility:taste-imagegen-frontend-mobile-ineligible",
  "execution_profiles": [
    "cursor-macos",
    "codex-macos"
  ],
  "inventory_digest": "sha256:24d6d8e4601342f235d7b445cf048eae473af305d23481a7d7d12b17b4758161",
  "lifecycle_state": "unqualified",
  "lineage": {
    "kind": "vendor",
    "relationship": "preserved_vendor_bytes",
    "upstream_release_id": null
  },
  "manifest": {
    "entry_hashes": [
      {
        "path": "SKILL.md",
        "sha256": "8a33389979f3074fa0926678e266ad2eb9234624472254469fc1ad916b9caa24",
        "size": 40326
      }
    ],
    "file_count": 1,
    "total_bytes": 40326
  },
  "notes": "Preserved vendor/adapted-source bytes; not qualified or consumer-activated.",
  "provenance": {
    "licence": "MIT",
    "publisher": "Leonxlnx",
    "repository": "https://github.com/Leonxlnx/taste-skill",
    "retrieved_at": "2026-08-31T08:00:00Z",
    "source_commit": "ccbc15639c97057cbfcf32ecebc38ef716e4bb37",
    "source_path": "skills/imagegen-frontend-mobile/SKILL.md",
    "source_ref": "main@ccbc15639c97057cbfcf32ecebc38ef716e4bb37",
    "trust_boundary": "linkskills-release-provenance"
  },
  "published_at": "2026-08-31T08:00:00Z",
  "publisher": "Leonxlnx",
  "release_id": "taste-imagegen-frontend-mobile@2.0.0",
  "release_kind": "vendor",
  "resource_descriptors": [
    "opaque:resource:taste-imagegen-frontend-mobile-skill-md"
  ],
  "retrieved_at": "2026-08-31T08:00:00Z",
  "schema_version": "0.1",
  "source_commit": "ccbc15639c97057cbfcf32ecebc38ef716e4bb37",
  "source_path": "skills/imagegen-frontend-mobile/SKILL.md",
  "source_ref": "main@ccbc15639c97057cbfcf32ecebc38ef716e4bb37",
  "storage_uri": "vendor-skills://taste-design/taste-imagegen-frontend-mobile/2.0.0",
  "version": "2.0.0"
}
