{
  "artifact_id": "gws-docs",
  "artifact_kind": "skill_pack",
  "attestation": {
    "algorithm": "ES256",
    "claims_digest": "sha256:676eb7a1d9e4a7bde0d19669299858daea3220650657199f21dcebb7fa6bf9d6",
    "issuer": "linkskills-publisher",
    "key_id": "linkskills-draft-unqualified",
    "signature": "draft-unqualified-no-signature",
    "trust_boundary": "linkskills-release-attestation"
  },
  "bundle_hash": "sha256:676eb7a1d9e4a7bde0d19669299858daea3220650657199f21dcebb7fa6bf9d6",
  "channel": "development",
  "content_digest": "sha256:676eb7a1d9e4a7bde0d19669299858daea3220650657199f21dcebb7fa6bf9d6",
  "eligibility_ref": "opaque:eligibility:gws-docs-ineligible",
  "execution_profiles": [],
  "inventory_digest": "sha256:927d6d65bd6b622e239d5780e547037b2eb40312ceddb9fb9995b2091be86658",
  "lifecycle_state": "unqualified",
  "lineage": {
    "kind": "vendor",
    "relationship": "preserved_vendor_bytes",
    "upstream_release_id": null
  },
  "manifest": {
    "entry_hashes": [
      {
        "path": "SKILL.md",
        "sha256": "676eb7a1d9e4a7bde0d19669299858daea3220650657199f21dcebb7fa6bf9d6",
        "size": 1564
      }
    ],
    "file_count": 1,
    "total_bytes": 1564
  },
  "notes": "Preserved unchanged vendor bytes; inactive and unqualified pending independent review.",
  "provenance": {
    "licence": "Apache-2.0",
    "publisher": "Google Workspace CLI",
    "repository": "https://github.com/googleworkspace/cli",
    "retrieved_at": "2026-08-24T00:00:00Z",
    "source_commit": "a3768d0e82ad83cca2da97724e46bea4ff0e6dbd",
    "source_path": "skills/gws-docs/SKILL.md",
    "source_ref": "main@a3768d0e82ad83cca2da97724e46bea4ff0e6dbd",
    "trust_boundary": "linkskills-release-provenance"
  },
  "published_at": "2026-08-24T00:00:00Z",
  "publisher": "LiNKskills",
  "release_id": "gws-docs@0.22.5",
  "release_kind": "vendor",
  "resource_descriptors": [
    "opaque:resource:gws-docs-skill-md"
  ],
  "retrieved_at": "2026-08-24T00:00:00Z",
  "schema_version": "0.1",
  "source_commit": "a3768d0e82ad83cca2da97724e46bea4ff0e6dbd",
  "source_path": "skills/gws-docs",
  "source_ref": "main@a3768d0e82ad83cca2da97724e46bea4ff0e6dbd",
  "storage_uri": "vendor-skills://google-workspace/gws-docs/0.22.5",
  "version": "0.22.5"
}
