{
  "artifact_id": "awesome-square",
  "artifact_kind": "skill_pack",
  "attestation": {
    "algorithm": "ES256",
    "claims_digest": "sha256:9beeaa358b54c8e61520894a1b3d10db36e983114f16ff567df90a72d58dc520",
    "issuer": "linkskills-publisher",
    "key_id": "linkskills-draft-intake",
    "signature": "draft-pending-evaluation-no-signature",
    "trust_boundary": "linkskills-release-attestation"
  },
  "bundle_hash": "sha256:490ed4d3785f3732dac5313d98be78f816836f9fa9ee212f2c77edf721e58d9d",
  "channel": "development",
  "content_digest": "sha256:9beeaa358b54c8e61520894a1b3d10db36e983114f16ff567df90a72d58dc520",
  "eligibility_ref": "opaque:eligibility:awesome-square-ineligible",
  "execution_profiles": [
    "cursor-macos",
    "codex-macos"
  ],
  "inventory_digest": "sha256:490ed4d3785f3732dac5313d98be78f816836f9fa9ee212f2c77edf721e58d9d",
  "lifecycle_state": "unqualified",
  "lineage": {
    "kind": "vendor",
    "relationship": "preserved_vendor_bytes",
    "upstream_release_id": null
  },
  "manifest": {
    "entry_hashes": [
      {
        "path": "DESIGN.md",
        "sha256": "0ef92dfc0aebfa0611456ea0168270075f39a44ba199afd09c3885411121f1fd",
        "size": 1533
      },
      {
        "path": "SKILL.md",
        "sha256": "332b404c21e30398266a1ef45c6759b0177cc6d17ddd576a6d7f941569b3f863",
        "size": 3362
      }
    ],
    "file_count": 2,
    "total_bytes": 4895
  },
  "notes": "Preserved vendor/adapted-source bytes; not qualified or consumer-activated.",
  "provenance": {
    "licence": "MIT",
    "publisher": "Bergside",
    "repository": "https://github.com/bergside/awesome-design-skills",
    "retrieved_at": "2026-08-31T08:00:00Z",
    "source_commit": "f631a09b4fcc0166f2e2c1a8c81906ef680c57e8",
    "source_path": "skills/square/SKILL.md",
    "source_ref": "main@f631a09b4fcc0166f2e2c1a8c81906ef680c57e8",
    "trust_boundary": "linkskills-release-provenance"
  },
  "published_at": "2026-08-31T08:00:00Z",
  "publisher": "Bergside",
  "release_id": "awesome-square@1.0.0",
  "release_kind": "vendor",
  "resource_descriptors": [
    "opaque:resource:awesome-square-skill-md"
  ],
  "retrieved_at": "2026-08-31T08:00:00Z",
  "schema_version": "0.1",
  "source_commit": "f631a09b4fcc0166f2e2c1a8c81906ef680c57e8",
  "source_path": "skills/square/SKILL.md",
  "source_ref": "main@f631a09b4fcc0166f2e2c1a8c81906ef680c57e8",
  "storage_uri": "vendor-skills://awesome-design/awesome-square/1.0.0",
  "version": "1.0.0"
}
