{
  "artifact_id": "recipe-save-email-to-doc",
  "artifact_kind": "skill_pack",
  "attestation": {
    "algorithm": "ES256",
    "claims_digest": "sha256:a84fda7be60b45988fcc932a98965c6687441af9707fe097f98192064edc74e2",
    "issuer": "linkskills-publisher",
    "key_id": "linkskills-draft-unqualified",
    "signature": "draft-unqualified-no-signature",
    "trust_boundary": "linkskills-release-attestation"
  },
  "bundle_hash": "sha256:a84fda7be60b45988fcc932a98965c6687441af9707fe097f98192064edc74e2",
  "channel": "canary",
  "content_digest": "sha256:a84fda7be60b45988fcc932a98965c6687441af9707fe097f98192064edc74e2",
  "eligibility_ref": "opaque:eligibility:recipe-save-email-to-doc-ineligible",
  "execution_profiles": [
    "gws-consumer"
  ],
  "inventory_digest": "sha256:f60b6b7b9255f105712360f89a5056d5ae63184bcbbbcc00a3f8c247abff33f2",
  "lifecycle_state": "eval_pending",
  "lineage": {
    "kind": "vendor",
    "relationship": "preserved_vendor_bytes",
    "upstream_release_id": null
  },
  "manifest": {
    "entry_hashes": [
      {
        "path": "SKILL.md",
        "sha256": "a84fda7be60b45988fcc932a98965c6687441af9707fe097f98192064edc74e2",
        "size": 1020
      }
    ],
    "file_count": 1,
    "total_bytes": 1020
  },
  "notes": "Approved source candidate for internal canary use; stable qualification, consumer activation, tool authority, and live publication are not claimed.",
  "provenance": {
    "licence": "Apache-2.0",
    "publisher": "Google Workspace CLI",
    "repository": "https://github.com/googleworkspace/cli",
    "retrieved_at": "2026-08-24T00:00:00Z",
    "source_commit": "a3768d0e82ad83cca2da97724e46bea4ff0e6dbd",
    "source_path": "skills/recipe-save-email-to-doc/SKILL.md",
    "source_ref": "main@a3768d0e82ad83cca2da97724e46bea4ff0e6dbd",
    "trust_boundary": "linkskills-release-provenance"
  },
  "published_at": "2026-08-24T00:00:00Z",
  "publisher": "LiNKskills",
  "release_id": "recipe-save-email-to-doc@0.22.5",
  "release_kind": "vendor",
  "resource_descriptors": [
    "opaque:resource:recipe-save-email-to-doc-skill-md"
  ],
  "retrieved_at": "2026-08-24T00:00:00Z",
  "schema_version": "0.1",
  "source_commit": "a3768d0e82ad83cca2da97724e46bea4ff0e6dbd",
  "source_path": "skills/recipe-save-email-to-doc",
  "source_ref": "main@a3768d0e82ad83cca2da97724e46bea4ff0e6dbd",
  "storage_uri": "vendor-skills://google-workspace/recipe-save-email-to-doc/0.22.5",
  "version": "0.22.5"
}
