{
  "artifact_id": "awesome-corporate",
  "artifact_kind": "skill_pack",
  "attestation": {
    "algorithm": "ES256",
    "claims_digest": "sha256:75f62ac2c4c5fa21e435be89e7bc276b2949dfd7de3a92693afb3a6d4791b1c0",
    "issuer": "linkskills-publisher",
    "key_id": "linkskills-draft-intake",
    "signature": "draft-pending-evaluation-no-signature",
    "trust_boundary": "linkskills-release-attestation"
  },
  "bundle_hash": "sha256:38f0591d6ca1dbe3ed5242821d66f910106e7e36f74d6763f4eb8a9e0702a3f2",
  "channel": "development",
  "content_digest": "sha256:75f62ac2c4c5fa21e435be89e7bc276b2949dfd7de3a92693afb3a6d4791b1c0",
  "eligibility_ref": "opaque:eligibility:awesome-corporate-ineligible",
  "execution_profiles": [
    "cursor-macos",
    "codex-macos"
  ],
  "inventory_digest": "sha256:38f0591d6ca1dbe3ed5242821d66f910106e7e36f74d6763f4eb8a9e0702a3f2",
  "lifecycle_state": "unqualified",
  "lineage": {
    "kind": "vendor",
    "relationship": "preserved_vendor_bytes",
    "upstream_release_id": null
  },
  "manifest": {
    "entry_hashes": [
      {
        "path": "DESIGN.md",
        "sha256": "be7707ec9ffb9fc3d4149d6b8d686e4bb3a60b77a974fe91c2263f6859cfd991",
        "size": 1570
      },
      {
        "path": "SKILL.md",
        "sha256": "2e4acf8cb18622e121b44d0b010c6c539dccd9cecc06b9c8c8767bee40f928ae",
        "size": 3968
      }
    ],
    "file_count": 2,
    "total_bytes": 5538
  },
  "notes": "Preserved vendor/adapted-source bytes; not qualified or consumer-activated.",
  "provenance": {
    "licence": "MIT",
    "publisher": "Bergside",
    "repository": "https://github.com/bergside/awesome-design-skills",
    "retrieved_at": "2026-08-31T08:00:00Z",
    "source_commit": "f631a09b4fcc0166f2e2c1a8c81906ef680c57e8",
    "source_path": "skills/corporate/SKILL.md",
    "source_ref": "main@f631a09b4fcc0166f2e2c1a8c81906ef680c57e8",
    "trust_boundary": "linkskills-release-provenance"
  },
  "published_at": "2026-08-31T08:00:00Z",
  "publisher": "Bergside",
  "release_id": "awesome-corporate@1.0.0",
  "release_kind": "vendor",
  "resource_descriptors": [
    "opaque:resource:awesome-corporate-skill-md"
  ],
  "retrieved_at": "2026-08-31T08:00:00Z",
  "schema_version": "0.1",
  "source_commit": "f631a09b4fcc0166f2e2c1a8c81906ef680c57e8",
  "source_path": "skills/corporate/SKILL.md",
  "source_ref": "main@f631a09b4fcc0166f2e2c1a8c81906ef680c57e8",
  "storage_uri": "vendor-skills://awesome-design/awesome-corporate/1.0.0",
  "version": "1.0.0"
}
