{
  "artifact_id": "gstack-context-restore",
  "artifact_kind": "skill_pack",
  "attestation": {
    "algorithm": "ES256",
    "claims_digest": "sha256:d838cdcab2855d1e34a1c844463640bae97e09dd716d6216e48d73cf4c559209",
    "issuer": "linkskills-publisher",
    "key_id": "linkskills-draft-intake",
    "signature": "draft-pending-evaluation-no-signature",
    "trust_boundary": "linkskills-release-attestation"
  },
  "bundle_hash": "sha256:01f5abeb353d26302fd50ef518d160ab8dafc3892f3c3f4d53edd894598e4679",
  "channel": "development",
  "content_digest": "sha256:d838cdcab2855d1e34a1c844463640bae97e09dd716d6216e48d73cf4c559209",
  "eligibility_ref": "opaque:eligibility:gstack-context-restore-ineligible",
  "execution_profiles": [
    "cursor-macos",
    "codex-macos"
  ],
  "inventory_digest": "sha256:01f5abeb353d26302fd50ef518d160ab8dafc3892f3c3f4d53edd894598e4679",
  "lifecycle_state": "unqualified",
  "lineage": {
    "kind": "vendor",
    "relationship": "preserved_vendor_bytes",
    "upstream_release_id": null
  },
  "manifest": {
    "entry_hashes": [
      {
        "path": "SKILL.md",
        "sha256": "d006b63c8568258f7f3f0201447f806e87e0386ef2a17c9d3598411c8d974d1b",
        "size": 50780
      },
      {
        "path": "SKILL.md.tmpl",
        "sha256": "f7d914383c88d4fb89db0a4d8f99592393ed098774c4a539159cab2a5f7e2aa4",
        "size": 5255
      }
    ],
    "file_count": 2,
    "total_bytes": 56035
  },
  "notes": "Preserved vendor/adapted-source bytes; not qualified or consumer-activated.",
  "provenance": {
    "licence": "MIT",
    "publisher": "LiNKtrend IDE Development",
    "repository": "https://github.com/linktrend/IDE-Development",
    "retrieved_at": "2026-08-31T08:00:00Z",
    "source_commit": "e32b578e2d11dcdf6e24baa8022f577efa26da24",
    "source_path": "core/runtime/skills/gstack/context-restore/SKILL.md",
    "source_ref": "development@e32b578e2d11dcdf6e24baa8022f577efa26da24",
    "trust_boundary": "linkskills-release-provenance"
  },
  "published_at": "2026-08-31T08:00:00Z",
  "publisher": "LiNKtrend IDE Development",
  "release_id": "gstack-context-restore@1.0.0",
  "release_kind": "vendor",
  "resource_descriptors": [
    "opaque:resource:gstack-context-restore-skill-md"
  ],
  "retrieved_at": "2026-08-31T08:00:00Z",
  "schema_version": "0.1",
  "source_commit": "e32b578e2d11dcdf6e24baa8022f577efa26da24",
  "source_path": "core/runtime/skills/gstack/context-restore/SKILL.md",
  "source_ref": "development@e32b578e2d11dcdf6e24baa8022f577efa26da24",
  "storage_uri": "vendor-skills://hybrid-development/gstack-context-restore/1.0.0",
  "version": "1.0.0"
}
