{
  "artifact_id": "recipe-create-expense-tracker",
  "artifact_kind": "skill_pack",
  "attestation": {
    "algorithm": "ES256",
    "claims_digest": "sha256:48ee6db9b966ead708ad5a593d248a06e1c3a2da0beeebf70cfdb988b8fc07d0",
    "issuer": "linkskills-publisher",
    "key_id": "linkskills-draft-unqualified",
    "signature": "draft-unqualified-no-signature",
    "trust_boundary": "linkskills-release-attestation"
  },
  "bundle_hash": "sha256:48ee6db9b966ead708ad5a593d248a06e1c3a2da0beeebf70cfdb988b8fc07d0",
  "channel": "canary",
  "content_digest": "sha256:48ee6db9b966ead708ad5a593d248a06e1c3a2da0beeebf70cfdb988b8fc07d0",
  "eligibility_ref": "opaque:eligibility:recipe-create-expense-tracker-ineligible",
  "execution_profiles": [
    "gws-consumer"
  ],
  "inventory_digest": "sha256:34b07230025c44ae9c33161d0bba2a3312930a72ad6f902d751775473665f0f5",
  "lifecycle_state": "eval_pending",
  "lineage": {
    "kind": "vendor",
    "relationship": "preserved_vendor_bytes",
    "upstream_release_id": null
  },
  "manifest": {
    "entry_hashes": [
      {
        "path": "SKILL.md",
        "sha256": "48ee6db9b966ead708ad5a593d248a06e1c3a2da0beeebf70cfdb988b8fc07d0",
        "size": 1172
      }
    ],
    "file_count": 1,
    "total_bytes": 1172
  },
  "notes": "Approved source candidate for internal canary use; stable qualification, consumer activation, tool authority, and live publication are not claimed.",
  "provenance": {
    "licence": "Apache-2.0",
    "publisher": "Google Workspace CLI",
    "repository": "https://github.com/googleworkspace/cli",
    "retrieved_at": "2026-08-24T00:00:00Z",
    "source_commit": "a3768d0e82ad83cca2da97724e46bea4ff0e6dbd",
    "source_path": "skills/recipe-create-expense-tracker/SKILL.md",
    "source_ref": "main@a3768d0e82ad83cca2da97724e46bea4ff0e6dbd",
    "trust_boundary": "linkskills-release-provenance"
  },
  "published_at": "2026-08-24T00:00:00Z",
  "publisher": "LiNKskills",
  "release_id": "recipe-create-expense-tracker@0.22.5",
  "release_kind": "vendor",
  "resource_descriptors": [
    "opaque:resource:recipe-create-expense-tracker-skill-md"
  ],
  "retrieved_at": "2026-08-24T00:00:00Z",
  "schema_version": "0.1",
  "source_commit": "a3768d0e82ad83cca2da97724e46bea4ff0e6dbd",
  "source_path": "skills/recipe-create-expense-tracker",
  "source_ref": "main@a3768d0e82ad83cca2da97724e46bea4ff0e6dbd",
  "storage_uri": "vendor-skills://google-workspace/recipe-create-expense-tracker/0.22.5",
  "version": "0.22.5"
}
