{
  "artifact_id": "recipe-create-gmail-filter",
  "artifact_kind": "skill_pack",
  "attestation": {
    "algorithm": "ES256",
    "claims_digest": "sha256:ed50dd3a616f5a628b6990ab840139622448bca654d9a5ba58f0bd03830286c8",
    "issuer": "linkskills-publisher",
    "key_id": "linkskills-draft-unqualified",
    "signature": "draft-unqualified-no-signature",
    "trust_boundary": "linkskills-release-attestation"
  },
  "bundle_hash": "sha256:ed50dd3a616f5a628b6990ab840139622448bca654d9a5ba58f0bd03830286c8",
  "channel": "development",
  "content_digest": "sha256:ed50dd3a616f5a628b6990ab840139622448bca654d9a5ba58f0bd03830286c8",
  "eligibility_ref": "opaque:eligibility:recipe-create-gmail-filter-ineligible",
  "execution_profiles": [],
  "inventory_digest": "sha256:c8ccf6349b7470ac356a2e219467ff6b795b3972156deca55d919eaa0a52584a",
  "lifecycle_state": "unqualified",
  "lineage": {
    "kind": "vendor",
    "relationship": "preserved_vendor_bytes",
    "upstream_release_id": null
  },
  "manifest": {
    "entry_hashes": [
      {
        "path": "SKILL.md",
        "sha256": "ed50dd3a616f5a628b6990ab840139622448bca654d9a5ba58f0bd03830286c8",
        "size": 1039
      }
    ],
    "file_count": 1,
    "total_bytes": 1039
  },
  "notes": "Preserved unchanged vendor bytes; inactive and unqualified pending independent review.",
  "provenance": {
    "licence": "Apache-2.0",
    "publisher": "Google Workspace CLI",
    "repository": "https://github.com/googleworkspace/cli",
    "retrieved_at": "2026-08-24T00:00:00Z",
    "source_commit": "a3768d0e82ad83cca2da97724e46bea4ff0e6dbd",
    "source_path": "skills/recipe-create-gmail-filter/SKILL.md",
    "source_ref": "main@a3768d0e82ad83cca2da97724e46bea4ff0e6dbd",
    "trust_boundary": "linkskills-release-provenance"
  },
  "published_at": "2026-08-24T00:00:00Z",
  "publisher": "LiNKskills",
  "release_id": "recipe-create-gmail-filter@0.22.5",
  "release_kind": "vendor",
  "resource_descriptors": [
    "opaque:resource:recipe-create-gmail-filter-skill-md"
  ],
  "retrieved_at": "2026-08-24T00:00:00Z",
  "schema_version": "0.1",
  "source_commit": "a3768d0e82ad83cca2da97724e46bea4ff0e6dbd",
  "source_path": "skills/recipe-create-gmail-filter",
  "source_ref": "main@a3768d0e82ad83cca2da97724e46bea4ff0e6dbd",
  "storage_uri": "vendor-skills://google-workspace/recipe-create-gmail-filter/0.22.5",
  "version": "0.22.5"
}
