{
  "artifact_id": "gws-gmail-send",
  "artifact_kind": "skill_pack",
  "attestation": {
    "algorithm": "ES256",
    "claims_digest": "sha256:5002f29ed58e3f14b826d4eadd917dd5f3e7f3ec8c6cbad7c61e4f340be519aa",
    "issuer": "linkskills-publisher",
    "key_id": "linkskills-draft-unqualified",
    "signature": "draft-unqualified-no-signature",
    "trust_boundary": "linkskills-release-attestation"
  },
  "bundle_hash": "sha256:5002f29ed58e3f14b826d4eadd917dd5f3e7f3ec8c6cbad7c61e4f340be519aa",
  "channel": "development",
  "content_digest": "sha256:5002f29ed58e3f14b826d4eadd917dd5f3e7f3ec8c6cbad7c61e4f340be519aa",
  "eligibility_ref": "opaque:eligibility:gws-gmail-send-ineligible",
  "execution_profiles": [
    "gws-consumer"
  ],
  "inventory_digest": "sha256:68cc8eb905647bbf61846fa63c2547dc868e670d1b96db62b18af8deea2692ff",
  "lifecycle_state": "unqualified",
  "lineage": {
    "kind": "vendor",
    "relationship": "preserved_vendor_bytes",
    "upstream_release_id": null
  },
  "manifest": {
    "entry_hashes": [
      {
        "path": "SKILL.md",
        "sha256": "5002f29ed58e3f14b826d4eadd917dd5f3e7f3ec8c6cbad7c61e4f340be519aa",
        "size": 2626
      }
    ],
    "file_count": 1,
    "total_bytes": 2626
  },
  "notes": "Preserved source; blocked from canary routing pending correction and re-audit.",
  "provenance": {
    "licence": "Apache-2.0",
    "publisher": "Google Workspace CLI",
    "repository": "https://github.com/googleworkspace/cli",
    "retrieved_at": "2026-08-24T00:00:00Z",
    "source_commit": "a3768d0e82ad83cca2da97724e46bea4ff0e6dbd",
    "source_path": "skills/gws-gmail-send/SKILL.md",
    "source_ref": "main@a3768d0e82ad83cca2da97724e46bea4ff0e6dbd",
    "trust_boundary": "linkskills-release-provenance"
  },
  "published_at": "2026-08-24T00:00:00Z",
  "publisher": "LiNKskills",
  "release_id": "gws-gmail-send@0.22.5",
  "release_kind": "vendor",
  "resource_descriptors": [
    "opaque:resource:gws-gmail-send-skill-md"
  ],
  "retrieved_at": "2026-08-24T00:00:00Z",
  "schema_version": "0.1",
  "source_commit": "a3768d0e82ad83cca2da97724e46bea4ff0e6dbd",
  "source_path": "skills/gws-gmail-send",
  "source_ref": "main@a3768d0e82ad83cca2da97724e46bea4ff0e6dbd",
  "storage_uri": "vendor-skills://google-workspace/gws-gmail-send/0.22.5",
  "version": "0.22.5"
}
